Type,Class,University,Responsibilities,Date
Instructor of Record,LING 419E – ``Investigating Linguistic Competence: Theory and Methods'',"Department of Linguistics, University of Maryland, College Park, MD","\Colorhref{https://adamliter.org/content/syllabi/LING419E_syllabus.pdf}{\faFilePdfO{} Syllabus},Designed \& taught advanced undergraduate seminar with 8 students,Adapted format for online teaching due to COVID-19 pandemic, Graded \& held office hours","Fall 2020"
TA,LING 311 – ``Syntax I’’,"Department of Linguistics, University of Maryland, College Park, MD","Graded  \& held office hours, Helped with transition to online teaching due to COVID-19 pandemic","Spring 2020"
TA,LING 200 – ``Introductory Linguistics’’,"Department of Linguistics, University of Maryland, College Park, MD","Taught 1 discussion section ($\approx$ 30 students), Graded \& held office hours","Fall 2018, Spring 2019"
TA,IAH 204 – ``Asia and the World'',"Department of Linguistics and Languages, Michigan State University, East Lansing, MI","Taught 3 discussion sections ($\approx$ 20 students each), Graded \& held office hours","Fall 2015, Spring 2016"
Tutoring,Departmentwide Undergraduate Tutor,"Department of Philosophy, Michigan State University, East Lansing, MI","Tutored peers in all undergraduate philosophy courses weekly","Fall 2013, Spring 2014"
